{
  "$schema": "datamodel/sharepoint/schemas/sp-list.schema.json",
  
"ListName": "Departments",
"Description": "Phòng ban",
"Columns": [
  { "Name": "DepartmentName", "Type": "Text", "Required": true },
  { "Name": "DepartmentCode", "Type": "Text" },
  { "Name": "ParentDepartmentId", "Type": "Lookup",
    "Lookup": { "List": "Departments", "Field": "ID", "Behavior": "restrict" }, "Description": "Phòng ban cấp cha" },
  { "Name": "Manager", "Type": "User" }
],
"ContentTypes": []

}
